{
  "curators": [
    {
      "name": "Wagner",
      "lastActive": "2025-05-04T19:30:31.395Z",
      "id": 1
    },
    {
      "name": "Wagner",
      "lastActive": "2025-05-06T01:53:16.743Z",
      "id": 2
    }
  ],
  "concepts": [
    {
      "category": "Cuisine",
      "value": "indiana",
      "timestamp": "2025-05-04T19:33:49.666Z",
      "id": 1
    },
    {
      "category": "Price Range",
      "value": "barato",
      "timestamp": "2025-05-04T19:33:49.675Z",
      "id": 2
    },
    {
      "category": "Mood",
      "value": "casual",
      "timestamp": "2025-05-04T19:33:49.678Z",
      "id": 3
    },
    {
      "category": "Setting",
      "value": "simples",
      "timestamp": "2025-05-04T19:33:49.679Z",
      "id": 4
    },
    {
      "category": "Crowd",
      "value": "indianos",
      "timestamp": "2025-05-04T19:33:49.681Z",
      "id": 5
    },
    {
      "category": "Crowd",
      "value": "diversificado",
      "timestamp": "2025-05-04T19:33:49.685Z",
      "id": 6
    },
    {
      "category": "Suitable For",
      "value": "almoço",
      "timestamp": "2025-05-04T19:33:49.687Z",
      "id": 7
    },
    {
      "category": "Food Style",
      "value": "comida do dia a dia",
      "timestamp": "2025-05-04T19:33:49.689Z",
      "id": 8
    },
    {
      "category": "Cuisine",
      "value": "Brazilian",
      "timestamp": "2025-05-05T01:14:01.835Z",
      "id": 9
    },
    {
      "category": "Menu",
      "value": "Barbecue",
      "timestamp": "2025-05-05T01:14:01.855Z",
      "id": 10
    },
    {
      "category": "Menu",
      "value": "Chicken",
      "timestamp": "2025-05-05T01:14:01.858Z",
      "id": 11
    },
    {
      "category": "Menu",
      "value": "Roast chicken",
      "timestamp": "2025-05-05T01:14:01.860Z",
      "id": 12
    },
    {
      "category": "Menu",
      "value": "Meat dishes",
      "timestamp": "2025-05-05T01:14:01.862Z",
      "id": 13
    },
    {
      "category": "Menu",
      "value": "Breaded chicken with rice and beans",
      "timestamp": "2025-05-05T01:14:01.863Z",
      "id": 14
    },
    {
      "category": "Menu",
      "value": "Feijoada",
      "timestamp": "2025-05-05T01:14:01.865Z",
      "id": 15
    },
    {
      "category": "Price Range",
      "value": "Popular",
      "timestamp": "2025-05-05T01:14:01.867Z",
      "id": 16
    },
    {
      "category": "Mood",
      "value": "Casual",
      "timestamp": "2025-05-05T01:14:01.869Z",
      "id": 17
    },
    {
      "category": "Mood",
      "value": "Busy on weekends",
      "timestamp": "2025-05-05T01:14:01.871Z",
      "id": 18
    },
    {
      "category": "Mood",
      "value": "Quiet during the week",
      "timestamp": "2025-05-05T01:14:01.875Z",
      "id": 19
    },
    {
      "category": "Setting",
      "value": "Simple",
      "timestamp": "2025-05-05T01:14:01.877Z",
      "id": 20
    },
    {
      "category": "Setting",
      "value": "Open",
      "timestamp": "2025-05-05T01:14:01.879Z",
      "id": 21
    },
    {
      "category": "Setting",
      "value": "Plastic tables",
      "timestamp": "2025-05-05T01:14:01.880Z",
      "id": 22
    },
    {
      "category": "Crowd",
      "value": "Locals",
      "timestamp": "2025-05-05T01:14:01.882Z",
      "id": 23
    },
    {
      "category": "Crowd",
      "value": "Workers",
      "timestamp": "2025-05-05T01:14:01.883Z",
      "id": 24
    },
    {
      "category": "Suitable For",
      "value": "Casual dining",
      "timestamp": "2025-05-05T01:14:01.888Z",
      "id": 25
    },
    {
      "category": "Suitable For",
      "value": "Experiencing local cuisine",
      "timestamp": "2025-05-05T01:14:01.889Z",
      "id": 26
    },
    {
      "category": "Food Style",
      "value": "Homemade",
      "timestamp": "2025-05-05T01:14:01.891Z",
      "id": 27
    },
    {
      "category": "Food Style",
      "value": "Comfort food",
      "timestamp": "2025-05-05T01:14:01.892Z",
      "id": 28
    },
    {
      "category": "Cuisine",
      "value": "Italian",
      "timestamp": "2025-05-05T02:07:00.023Z",
      "id": 29
    },
    {
      "category": "Menu",
      "value": "lasagna",
      "timestamp": "2025-05-05T02:07:00.033Z",
      "id": 30
    },
    {
      "category": "Menu",
      "value": "bruschetta",
      "timestamp": "2025-05-05T02:07:00.036Z",
      "id": 31
    },
    {
      "category": "Menu",
      "value": "burrata",
      "timestamp": "2025-05-05T02:07:00.038Z",
      "id": 32
    },
    {
      "category": "Menu",
      "value": "pizza",
      "timestamp": "2025-05-05T02:07:00.040Z",
      "id": 33
    },
    {
      "category": "Price Range",
      "value": "mid-range",
      "timestamp": "2025-05-05T02:07:00.042Z",
      "id": 34
    },
    {
      "category": "Mood",
      "value": "traditional",
      "timestamp": "2025-05-05T02:07:00.044Z",
      "id": 35
    },
    {
      "category": "Mood",
      "value": "intimate",
      "timestamp": "2025-05-05T02:07:00.046Z",
      "id": 36
    },
    {
      "category": "Mood",
      "value": "not very crowded",
      "timestamp": "2025-05-05T02:07:00.049Z",
      "id": 37
    },
    {
      "category": "Setting",
      "value": "Italian environment",
      "timestamp": "2025-05-05T02:07:00.051Z",
      "id": 38
    },
    {
      "category": "Setting",
      "value": "lots of photos on the wall",
      "timestamp": "2025-05-05T02:07:00.052Z",
      "id": 39
    },
    {
      "category": "Setting",
      "value": "surrounded by history",
      "timestamp": "2025-05-05T02:07:00.055Z",
      "id": 40
    },
    {
      "category": "Suitable For",
      "value": "romantic evening",
      "timestamp": "2025-05-05T02:07:00.057Z",
      "id": 41
    },
    {
      "category": "Suitable For",
      "value": "birthdays",
      "timestamp": "2025-05-05T02:07:00.058Z",
      "id": 42
    },
    {
      "category": "Suitable For",
      "value": "gastronomic night out",
      "timestamp": "2025-05-05T02:07:00.060Z",
      "id": 43
    },
    {
      "category": "Food Style",
      "value": "family meals",
      "timestamp": "2025-05-05T02:07:00.062Z",
      "id": 44
    },
    {
      "category": "Drinks",
      "value": "wines",
      "timestamp": "2025-05-05T02:07:00.063Z",
      "id": 45
    },
    {
      "category": "Drinks",
      "value": "house wine",
      "timestamp": "2025-05-05T02:07:00.064Z",
      "id": 46
    },
    {
      "category": "Menu",
      "value": "roasted beef",
      "timestamp": "2025-05-05T02:49:18.523Z",
      "id": 47
    },
    {
      "category": "Menu",
      "value": "frog fillet",
      "timestamp": "2025-05-05T02:49:18.531Z",
      "id": 48
    },
    {
      "category": "Menu",
      "value": "chayote with pepper",
      "timestamp": "2025-05-05T02:49:18.533Z",
      "id": 49
    },
    {
      "category": "Cuisine",
      "value": "Steakhouse",
      "timestamp": "2025-05-05T22:27:25.578Z",
      "id": 50
    },
    {
      "category": "Menu",
      "value": "Chouriço",
      "timestamp": "2025-05-05T22:27:25.586Z",
      "id": 51
    },
    {
      "category": "Menu",
      "value": "Chouriço steak",
      "timestamp": "2025-05-05T22:27:25.588Z",
      "id": 52
    },
    {
      "category": "Food Style",
      "value": "Buffet",
      "timestamp": "2025-05-05T22:27:25.590Z",
      "id": 53
    },
    {
      "category": "Drinks",
      "value": "Sparkling water",
      "timestamp": "2025-05-05T22:27:25.591Z",
      "id": 54
    },
    {
      "category": "Drinks",
      "value": "House wine",
      "timestamp": "2025-05-05T22:27:25.593Z",
      "id": 55
    },
    {
      "category": "Menu",
      "value": "Eggs Benedict",
      "timestamp": "2025-05-06T01:09:10.715Z",
      "id": 56
    },
    {
      "category": "Menu",
      "value": "full breakfast",
      "timestamp": "2025-05-06T01:09:10.736Z",
      "id": 57
    },
    {
      "category": "Menu",
      "value": "bacon",
      "timestamp": "2025-05-06T01:09:10.737Z",
      "id": 58
    },
    {
      "category": "Menu",
      "value": "salsas",
      "timestamp": "2025-05-06T01:09:10.739Z",
      "id": 59
    },
    {
      "category": "Menu",
      "value": "ovos",
      "timestamp": "2025-05-06T01:09:10.742Z",
      "id": 60
    },
    {
      "category": "Menu",
      "value": "panqueca",
      "timestamp": "2025-05-06T01:09:10.744Z",
      "id": 61
    },
    {
      "category": "Mood",
      "value": "animado",
      "timestamp": "2025-05-06T01:09:10.746Z",
      "id": 62
    },
    {
      "category": "Mood",
      "value": "agitado",
      "timestamp": "2025-05-06T01:09:10.748Z",
      "id": 63
    },
    {
      "category": "Setting",
      "value": "traditional",
      "timestamp": "2025-05-06T01:09:10.749Z",
      "id": 64
    },
    {
      "category": "Setting",
      "value": "pop culture",
      "timestamp": "2025-05-06T01:09:10.750Z",
      "id": 65
    },
    {
      "category": "Crowd",
      "value": "locals",
      "timestamp": "2025-05-06T01:09:10.751Z",
      "id": 66
    },
    {
      "category": "Crowd",
      "value": "tourists",
      "timestamp": "2025-05-06T01:09:10.752Z",
      "id": 67
    },
    {
      "category": "Suitable For",
      "value": "brunch",
      "timestamp": "2025-05-06T01:09:10.753Z",
      "id": 68
    },
    {
      "category": "Suitable For",
      "value": "breakfast",
      "timestamp": "2025-05-06T01:09:10.754Z",
      "id": 69
    },
    {
      "category": "Suitable For",
      "value": "large groups",
      "timestamp": "2025-05-06T01:09:10.755Z",
      "id": 70
    },
    {
      "category": "Suitable For",
      "value": "birthday celebrations",
      "timestamp": "2025-05-06T01:09:10.756Z",
      "id": 71
    },
    {
      "category": "Food Style",
      "value": "comfort food",
      "timestamp": "2025-05-06T01:09:10.758Z",
      "id": 72
    },
    {
      "category": "Special Features",
      "value": "Arcade Games",
      "timestamp": "2025-05-06T01:46:32.964Z",
      "id": 73
    },
    {